{
  "schema_version": "x07.mcp.corpus.summary@0.2.0",
  "generated_at": "2026-01-01T00:00:00Z",
  "tool": "hardproof",
  "tool_version": "0.4.0-beta.8",
  "ok": true,
  "details": {
    "report_id": "quality-report-001",
    "results": [
      {
        "server_id": "good-http",
        "ok": true,
        "status": "warn",
        "score_truth_status": "publishable",
        "scores": {
          "conformance": 100,
          "security": 100,
          "performance": 100,
          "trust": 80,
          "reliability": 100,
          "overall": 96
        },
        "result_path": "out/good-http/result.json",
        "out_dir": "out/good-http"
      }
    ],
    "counts": {
      "total": 1,
      "ok": 1,
      "failed": 0
    },
    "dimension_averages": {
      "conformance": 100,
      "security": 100,
      "performance": 100,
      "trust": 80,
      "reliability": 100,
      "overall": 96
    }
  }
}
